{
  "$schema": "../../schemas/native-candidate-review.schema.json",
  "schema_version": "1.0",
  "feature_id": "EPP-N01",
  "review_type": "independent_technical",
  "review_scope": "entire_candidate",
  "candidate_commit": "28efd6ccdc4a9e7900a4e50f9f323fd0865b9211",
  "candidate_tree": "50900ed4a7a93c5018b9cd85660f7d7aa6d10c49",
  "task_ids": [
    "T001",
    "T002",
    "T003",
    "T004",
    "T005",
    "T006",
    "T007",
    "T008",
    "T009",
    "T010",
    "T011",
    "T012",
    "T013",
    "T014",
    "T015",
    "T016",
    "T017",
    "T018",
    "T019",
    "T020",
    "T021",
    "T022",
    "T023",
    "T024",
    "T025",
    "T026"
  ],
  "reviewer_identity": "/root/native_candidate_review",
  "implementation_authors": [
    "Test User <test@example.com>",
    "Codex implementation team",
    "/root",
    "/root/native_editor",
    "/root/dashboard_review"
  ],
  "reviewed_at": "2026-09-05T10:00:01.037762Z",
  "result": "passed",
  "open_actionable_findings": 0,
  "human_study_evidence": false,
  "evidence": "Passed independent technical review of the entire native implementation candidate 28efd6ccdc4a9e7900a4e50f9f323fd0865b9211, tree 50900ed4a7a93c5018b9cd85660f7d7aa6d10c49, frozen at e15c07497e0440d243ea61b1b7e2e4d0a9f1bd25. This is a new actual review after the completed gate. Reviewer authored no implementation, correction or public projection. Author identities are the complete observed Git author set plus known writer roles, not an invented exhaustive historical agent enumeration.\n\nCarry forward the independently reviewed unchanged scope in NATIVE-REVIEW-20260905-7F55B31C.json, preserved verbatim, and its original findings/closures: native language/schema/quantities, canonical authoring and AI/canvas authority, persistence/migration17, artifact confinement/integrity, lifecycle/races/recovery, service/API/HTTP/CLI/MCP, frontend/editor recovery, resources/assets/wheel/sdist/Docker, governance/dashboard, actual packaged predecessor recovery and diagnostic tracing. Rivet-independent native execution preserves the legacy path. Development examples remain separate from benchmark qualification. Original native/editor and governance findings remain closed; old execution identities, failed attempts and platform limits are retained.\n\nCumulative source correspondence checks every one of the 15 changed non-program files against the independently reviewed CodeQL boundary correction a4aaace2, Tornado pin972ae6f2, image scanfa479118 and correction8a2a5276. The only other non-program delta is the previously accepted T027/T029 checkbox pair. All43 planning files retain normalized meaning, current Q-PLANNING scope3457699a31cf4134936f0ee34238beeae7a974ebc6de38f3dc6ba8ac4a9c30fb and T001/T002 acceptance. Current28-done/four-pending task history is distinct from the frozen26-included/six-pending delivery partition. All11 introducing manifests TR0110-0120, source/program trees, raw input/output hashes and canonical state chains verify; all51 registry evidence artifact bindings verify. Freeze121 has a closed lease, no prior review attached and whole_feature_complete false. Exact attached e15 authoritative validation passed with zero blockers, benchmark0/100 and releasefalse.\n\nThe CodeQL boundary correction has my actual18 critical HTTP/domain tests. Fresh local CodeQL2.26.4 on exact28efd used the same packs and43 reported rules as H1: the original five new signatures are absent, with no new signature and only two unchanged preexisting signatures remaining. Actual log/SARIF/source-manifest hashes were independently checked. This neither dismisses those two baseline findings nor claims GitHub H2 clearance. SARIF161081611d461441ca0c4dea3e29d3784d82f0fae555efc3793f6fdd9d18731b binds the new analysis.\n\nMy OCI-SOURCE-01/REPORT-02/DISPATCH-03 P2 findings on the original helper are independently closed on8a2a5276. Original actual Git/malformed-report/Bash probes were replayed with output routing only: stale-source cancellation and malformed records reject, unfixed-policy controls remain valid, and every omitted input now selects the scan. The immutable pinned scanner/current-DB/coverage/policy/context/public-projection boundaries were reviewed. Original findings and rejected/interrupted runs remain retained. All3,473 archived and extracted context blobs match exact40b1 Git source; its Docker inputs match28efd. ExactLF image336e4f0d0d479777da9a482586e779e52e286981f1ac04d905c8ab719226569f completed standard cold-offline smoke and the e15 current-DB scan with zero reported policy findings. EarlierCRLF imaged134 has an explicit correction, not a relabeled LF-source claim. Historical native browser, recovery and tracing evidence retain their original subjects and are not presented as newly repeated journeys.\n\nThe actual complete scripts/check-dev-merge.sh gate on frozen e15 ran2026-09-05T09:18:33.3468613Z through09:51:29.1779068Z and returned exit0. Raw logc8434a942852c669e7a4a8ace9fd93de2dca902d4143c3d11e7fa6238450ed06 and actual observation were checked. All175 original browser case identities are preserved:170passed/five unchanged skips, zero flaky/unexpected outcomes, all retry indices0. Frontend547passed; terminal Python stage summaries contain no failures. HTMLf9ef58bf63af4f2bafa5753c5699d92f44c96db9d998e35ec204668278cf7772 and a selected case projection retain exact outcomes. Fixture console diagnostics are not represented as absent.\n\nFresh wheelfe2ca54fa1eb7bd005aa01518cfad4c369562f4af9c41f761b65c8279147dbbf and sdista254bfe52f4413086832ad0b7effa244c0a4e07e9788a53a46defcebc8b7a4c1 independently match669/672 source files,674 wheel RECORD entries,13 exact UI assets, complete requirements/extras and build checksums, with stable bytes before/after review. The original gate honestly records source_clean_after=false: only generated runtime-extra-lock.json changed its raw uv.lock provenance field284093 to actualCRLF f4a704. Every other field and tracked source path is unchanged; the generated record21b215 matches both reviewed archives. Raw generated bytes/status are preserved. Restoring only that generated file does not alter or upgrade the historical dirty-after observation. No product patch or repeat gate is required solely for this known build output.\n\nDetailed bounded reports and probes are retained as independent-candidate-preparation-28efd6cc.md, independent-oci-helper-closure-8a2a5276.md, independent-e15-image-and-oci-history-review.md, independent-fresh-distribution-review-e15.md, independent-codeql-public-projection-review-28efd.md and independent-complete-gate-review-e15.md. Their public evidence projections preserve originals and distinguish local execution from CI/deployment. I ran no duplicate broad suite/build/install/container/analyzer during final assembly.\n\nVerdict: entire exact native candidate passed independent technical review, zero open actionable P1/P2 findings within this implementation scope relative to baseline7404a549. Required pre-push gate/history scans, actual terminal H2 GitHub results, dev integration and exact published/deployed verification, human study follow-up and final milestone reporting remain pending. Human-study evidence is false. No whole-feature completion, main-production, publication or release acceptance is implied."
}
