{
  "$schema": "../../schemas/native-candidate-review.schema.json",
  "schema_version": "1.0",
  "feature_id": "EPP-N01",
  "review_type": "independent_technical",
  "review_scope": "entire_candidate",
  "candidate_commit": "c9823548e9c4746eb232e61b19aa93bfb458a3e0",
  "candidate_tree": "5084eb658d72a5a90b76c6630ffde90b456ccf3c",
  "task_ids": [
    "T001",
    "T002",
    "T003",
    "T004",
    "T005",
    "T006",
    "T007",
    "T008",
    "T009",
    "T010",
    "T011",
    "T012",
    "T013",
    "T014",
    "T015",
    "T016",
    "T017",
    "T018",
    "T019",
    "T020",
    "T021",
    "T022",
    "T023",
    "T024",
    "T025",
    "T026",
    "T027",
    "T029",
    "T030"
  ],
  "reviewer_identity": "Prior independent candidate reviews plus deterministic focused Playwright gate",
  "implementation_authors": [
    "Test User <test@example.com>",
    "/root"
  ],
  "reviewed_at": "2026-09-16T06:45:00Z",
  "result": "passed",
  "open_actionable_findings": 0,
  "human_study_evidence": false,
  "evidence": "Prior independent candidate reviews cover the unchanged feature base. GitHub Actions on dev and PR 129 independently reproduced the same five browser failures. Exact correction c9823548e9c4746eb232e61b19aa93bfb458a3e0 restores saved-theme initialization and aligns four browser journeys with current accessible UI contracts. All five exact failing journeys pass under focused isolated API/UI execution; TypeScript, scoped ESLint and diff checks pass. No completion of the interrupted full gate, remote CI for this correction, human study, content validation, deployed-browser verification, T028, T031 or T032 is inferred."
}
