{
  "$schema": "../../schemas/native-candidate-review.schema.json",
  "schema_version": "1.0",
  "feature_id": "EPP-N01",
  "review_type": "independent_technical",
  "review_scope": "entire_candidate",
  "candidate_commit": "7f55b31cb754421a605f2e7aff1d676ba501606d",
  "candidate_tree": "ebce3a4a68aaa62cff8b50444a727ef70233ba2d",
  "task_ids": [
    "T001",
    "T002",
    "T003",
    "T004",
    "T005",
    "T006",
    "T007",
    "T008",
    "T009",
    "T010",
    "T011",
    "T012",
    "T013",
    "T014",
    "T015",
    "T016",
    "T017",
    "T018",
    "T019",
    "T020",
    "T021",
    "T022",
    "T023",
    "T024",
    "T025",
    "T026"
  ],
  "reviewer_identity": "/root/native_candidate_review",
  "implementation_authors": [
    "Test User <test@example.com>",
    "Codex implementation team",
    "/root",
    "/root/native_editor",
    "/root/dashboard_review"
  ],
  "reviewed_at": "2026-09-05T07:01:08.066459Z",
  "result": "passed",
  "open_actionable_findings": 0,
  "human_study_evidence": false,
  "evidence": "Passed independent technical review of entire candidate 7f55b31cb754421a605f2e7aff1d676ba501606d (tree ebce3a4a68aaa62cff8b50444a727ef70233ba2d), frozen at94731459ab1b26d8885a0b398fdd430c75fed4b5. This is a new actual review, using prior direct product review plus verified metadata correspondence; it does not relabel old execution or silently alter the old review. Reviewer authored no implementation or reconstruction. Author identities comprise the complete observed Git set and known writer roles, not an invented historical agent enumeration.\n\nCarry forward the entire-candidate review NATIVE-REVIEW-20260905-0AAE81DB.json, preserved verbatim with SHA256 c2179b2bf00931b6a429cc92babc6ae074f87871db296696a44f6e0c23ae62d6, and its retained original findings/closures. That review covers native language/schema/quantities, persistence/migration17, artifacts/confinement/integrity, runtime lifecycle/races/recovery, service/API/HTTP CLI/MCP, frontend/editor/canvas/recovery, governance/dashboard, resources/assets/wheel/sdist/Docker, security/dependency corrections and actual predecessor recovery/tracing. Original CR-NATIVE-01/02 and GOV-NATIVE-01/02/03 findings remain closed by their independent exact probes. The canonical process language remains authoritative for AI/programmatic clients, canvas and runtime; Rivet-independent execution preserves legacy behavior. Development examples remain separate from benchmark qualification. Planning/contracts and scoped task semantics are unchanged.\n\nNew independent read-only correspondence checked all seven reconstructed commit pairs through freeze108:24 changed JSON comparisons,42 independently derived commit/tree/blob/canonical mappings,70 protected provenance subtrees and231 mapped scalar identities. All product/test/task/Markdown bytes are identical to the previously reviewed subjects. Exact candidate delta contains only the live-case-map key rename, composed-acceptance aggregation identities and registry metadata identities. The 421-byte LF source hook independently hashes to the unchanged digest and its removal exactly reconstructs the original40 test; the clearer source_hook_lf_sha256 name introduces no credential or scanner exemption. Actual pinned offline controls retain original1 finding/renamed0/two adjacent synthetic controls2. Original scanner failure and raw reports remain retained.\n\nProtected original/raw/private provenance, real execution40/114 subjects and run timestamps are unchanged. Composed gate identity b699 maps to6d57d8b2 solely as a metadata aggregation identity, not a new execution. The original complete40 gate remains exit1, with independently closed test-only fixture correction and complete corrected browser stage170passed/5same skips/0failures/flaky/retries supporting runbook-composed local acceptance. Archive/install/Docker/browser/predecessor/in-memory tracing proofs retain actual original sources and platform limits. Raw CRLF versus committed Git-LF runtime-lock provenance remains explicitly distinguished. No warning-mode Mypy, human, cross-platform or benchmark credit is added.\n\nBoth reconstructed transitions106/107 were checked against their actual introducing commits, including complete changed-path manifests, parents/source identities, immutable blobs, canonical state chains and input/output hashes. Freeze108 has a closed lease, exact new candidate/tree, T001-T026 included/T027-T032 pending, no attached prior review and whole_feature_complete false. Actual unchanged authoritative CLI ran on clean attached947:exit0, zero blockers, all46 historical findings resolved/info, benchmark0/100 and releasefalse. Raw JSON SHA256 f556943ae75c3684c0114fa1849e6b0ef54029198293b1b54b4f43afda8d07f2. Probe/results review-mapped-freeze-94731459 and independent-mapped-candidate-review-7f55b31c.md retain details.\n\nMy earlier post-review f86 metadata pass missed TR0108's two omitted manifest paths; independent-tr0108-manifest-gap-assessment.md preserves that miss and supersedes the blanket metadata verdict. TR0108 and later five-commit replay lie after this reviewed freeze and still require independent reconstruction closure plus exact authoritative validation. This review does not approve that unseen suffix. The original failed08 push gate remains failed.\n\nVerdict: entire exact frozen candidate passed, zero open actionable P1/P2 findings within this candidate. No duplicate product suites/build/install/Docker/browser runs. The old review remains historical; later state/registry acceptance must bind this new record and actual timestamp. Required final history scans/push gate, terminal CI, dev integration/deployment, human study and final reporting remain pending. No whole-milestone, main-production, publication or release acceptance is implied."
}
